company,status_id,status_message,link_name,status_type,status_link,status_published,likes,comments,shares
beckhoff,119761528047992_774015969289208,Beckhoff Trade Show TV at Interpack 2014: Highly efficient and highly flexible – PC-based Control for the packaging industry,Interpack 2014: PC-based Control for the packaging industry,video,http://youtu.be/xKCy0ZtxPuM,2014-05-20 07:51:48,5,2,0
beckhoff,119761528047992_773664365991035,"Webinar: How to upgrade easily - first steps with TwinCAT 3 PLC. Thursday, 22 May 2014, 9 am and 5 pm CEST. Register now!",Beckhoff Webinars,link,http://www.beckhoff.com/webinar,2014-05-19 15:13:58,13,1,2
beckhoff,119761528047992_771973156160156,Smart power box with data logging function: IP 67 power distributor with integrated current and voltage measurement,Smart power box with data logging function,link,http://www.beckhoff.com/english/press/pr2014.htm,2014-05-16 14:13:10,13,1,4
beckhoff,119761528047992_771168366240635,Park Hotel Vitznau: Intelligent building controls: PC- and BACnet-based building automation boosts efficiency and comfort behind historic walls,Park Hotel Vitznau: Intelligent building controls,link,http://www.pc-control.net/pdf/012014/solutions/pcc_0114_park-hotel-vitznau_e.pdf,2014-05-15 08:19:40,8,0,4
beckhoff,119761528047992_771140516243420,"Video of the visit of the German Federal Chancellor Angela Merkel and Mark Rutte, Prime Minister of the Netherlands, at the Beckhoff booth at Hannover Messe 2014",Hannover Messe 2014: Visit of the Federal Chancellor Dr. Angela Merkel,video,http://www.youtube.com/watch?v=uKQkVsrL1D0,2014-05-15 06:59:32,7,0,4
beckhoff,119761528047992_768009149889890,Integrated building automation in the Tower 185 office building: Flexible use of space and energy-efficient operation with Beckhoff Building Automation,Application film: Building Automation in the Tower 185 office building,video,http://youtu.be/8wU_nKmCpQ0,2014-05-09 10:04:28,19,1,2
beckhoff,119761528047992_763727903651348,Beckhoff at Interpack 2014: Beckhoff Solution Forum at Outdoor area FG 15-1,Beckhoff at Interpack 2014,link,http://www.beckhoff.com/english/beckhoff/trade_show_interpack.htm,2014-04-30 10:37:40,15,2,2
beckhoff,119761528047992_759796544044484,Google Glass for industrial automation: Convergence of mobile technologies and automation,Google Glass for industrial automation,link,http://www.pc-control.net/pdf/012014/interview/pcc_0114_google-glass_e.pdf,2014-04-22 14:57:12,43,1,10
beckhoff,119761528047992_528372613853546,,Beckhoff Automation's cover photo,photo,https://www.facebook.com/beckhoff/photos/a.370307692993373.89679.119761528047992/528372613853546/?type=3,2014-04-14 05:43:06,19,0,2
beckhoff,119761528047992_753939407963531,"Beckhoff Trade Show TV – Day 4 from Hannover Messe 2014. Subjects: compact servomotors, scalable control technology with new CX5100 und CX8000 Embedded PCs, evolution of the EtherCAT technology.","Hannover Messe 2014, Day 4: Beckhoff Trade Show TV",video,http://youtu.be/eZ-HEgBCwic,2014-04-11 07:10:22,9,0,1
beckhoff,119761528047992_753483001342505,"Beckhoff Trade Show TV – Day 3 from Hannover Messe 2014. Subjects: Beckhoff press conference, TwinCAT news for HMI and engineering, Tec2You.","Hannover Messe 2014, Day 3: Beckhoff Trade Show TV",video,http://youtu.be/tx5Ju6800GE,2014-04-10 08:27:19,15,0,4
beckhoff,119761528047992_753076898049782,"Beckhoff Trade Show TV – Day 2 from Hannover Messe 2014. Subjects: Universal multi-touch, new temperature measuring terminals for Scientific Automation, zinc die-cast EtherCAT Box modules for extremely harsh environmental conditions.","Hannover Messe 2014, Day 2: Beckhoff Trade Show TV",video,http://youtu.be/metw5Rg1Sus,2014-04-09 13:00:46,10,0,1
beckhoff,119761528047992_752552041435601,"Beckhoff Trade Show TV – Day 1 from Hannover Messe 2014. Subjects: Visit of Federal Chancellor Angela Merkel, live technology demonstration at the Beckhoff Industry 4.0 Forum.","Hannover Messe 2014, Day 1: Beckhoff Trade Show TV",video,http://youtu.be/bvbvUp1SF3c,2014-04-08 10:39:45,18,0,9
beckhoff,119761528047992_752115678145904,Hannover Messe: Federal Chancellor visited Beckhoff,Hannover Messe: Federal Chancellor visited Beckhoff,link,http://www.beckhoff.com/english/press/pr1514.htm,2014-04-07 12:30:44,54,1,16
beckhoff,119761528047992_753082194715919,Federal Chancellor Angela Merkel visited Beckhoff Automation at Hannover Messe 2014,Cover Photos,photo,https://www.facebook.com/beckhoff/photos/a.370307692993373.89679.119761528047992/753082194715919/?type=3,2014-04-07 10:00:00,22,0,0
beckhoff,119761528047992_695862753793611,XMold – System solution for injection molding,XMold – System solution for injection molding,link,http://www.beckhoff.com/english.asp?press%2Fnews0314.php,2014-03-28 15:20:08,16,2,5
beckhoff,119761528047992_694925223887364,"Light+Building 2014: Integrated building automation: TwinCAT Building Automation – Efficient engineering for all building systems : Hall 11.0, Booth C56",Light+Building 2014: Integrated building automation,link,http://www.beckhoff.com/english/beckhoff/trade_show_light_building.htm,2014-03-26 14:06:09,9,1,1
beckhoff,119761528047992_694821603897726,"TwinCAT 3 | Multi-core and multi-tasking support:
Optimised scalability and use of resources.
",TwinCAT 3: Multi-core and multi-tasking support,video,http://youtu.be/ylV9L2YTpwg,2014-03-26 09:24:18,6,0,2
beckhoff,119761528047992_689610297752190,Preview: Beckhoff at Hannover Messe 2014: PC-based Control as the technological foundation for Smart Factory applications,Preview: Beckhoff at Hannover Messe 2014,link,http://www.beckhoff.com/english/beckhoff/trade_show_hmi.htm,2014-03-14 13:56:16,16,0,1
beckhoff,119761528047992_688194487893771,Beckhoff at Hannover Messe 2014: PC-based Control – the basic technology for the Smart Factory.,Beckhoff at Hannover Messe 2014,video,http://youtu.be/mWO53v0f8bY,2014-03-11 14:34:37,23,0,1
beckhoff,119761528047992_686066724773214,"Beckhoff at Prolight + Sound 2014: System-integrated control technology to enable your creativity with PC-based Control in Hall 9.0, Booth E84.",Beckhoff at Prolight + Sound 2014,link,http://www.beckhoff.com/english/beckhoff/trade_show_prolight_sound.htm,2014-03-07 08:02:08,11,0,2
beckhoff,119761528047992_681078251938728,Stainless steel EtherCAT Box in Hygienic Design,Stainless steel EtherCAT Box in Hygienic Design,video,http://youtu.be/GgGRjcjfv_g,2014-02-24 15:12:16,11,0,5
beckhoff,119761528047992_679116125468274,EtherCAT Terminals for extended temperature range: The operating temperature range of selected EtherCAT Terminals and Couplers has been extended to -25…+60 °C.,EtherCAT Terminals for extended temperature range,link,http://www.beckhoff.com/english/press/news0114.htm,2014-02-20 10:33:09,8,0,0
beckhoff,119761528047992_675041365875750,Multi-touch advantages plus maximum CPU power: Beckhoff CP22xx Built-in Panel PC – the most powerful device in the flexible multi-touch panel range,Multi-touch advantages plus maximum CPU power,link,http://www.beckhoff.com/english/press/pr0114.htm,2014-02-11 15:44:41,19,0,2
beckhoff,119761528047992_673086966071190,E-World 2014: PC Control for the energy industry,E-World 2014: PC Control for the energy industry,link,http://www.beckhoff.com/english/beckhoff/trade_show_e-world.htm,2014-02-07 15:14:23,18,0,1
beckhoff,119761528047992_671313229581897,Tire Technology Expo: PC Control for the tire industry,Tire Technology Expo: PC Control for the tire industry,link,http://www.beckhoff.com/english/beckhoff/trade_show_tiretech.htm,2014-02-04 14:22:58,8,0,2
beckhoff,119761528047992_667429073303646,EtherCAT Box: Acceleration and angle measurement directly in the field: Press Release,EtherCAT Box: Acceleration and angle measurement directly in the field,link,http://www.beckhoff.com/english/press/pr2513.htm,2014-01-28 15:30:12,10,0,1
beckhoff,119761528047992_662132603833293,Turning waste into a “green“ energy source,Turning waste into a “green“ energy source,link,http://www.pc-control.net/pdf/042013/solutions/pcc_0413_gts_e.pdf,2014-01-17 12:10:03,7,0,0
beckhoff,119761528047992_658182757561611,"Flexibility and precision, even with red-hot steel","Flexibility and precision, even with red-hot steel",link,http://www.pc-control.net/pdf/032013/solutions/pcc_0313_ims_e.pdf,2014-01-08 12:38:23,14,1,4
beckhoff,119761528047992_704750379549101,TwinCAT 3 unites PC Control and science for simplified cable robot operation,TwinCAT 3 unites PC Control and science for simplified cable robot operation,link,http://www.pc-control.net/pdf/042013/solutions/pcc_0413_uni-duisburg_e.pdf,2014-01-03 08:00:09,25,0,1
beckhoff,119761528047992_696843380339801,Two Beckhoff XTS systems in combination with a KUKA robot,XTS-KUKA application at SPS IPC Drives 2013,video,http://youtu.be/6A01LIVnMq0,2013-12-19 14:33:43,30,0,4
beckhoff,119761528047992_696297120394427,Technology study: Google Glass for industrial automation,Google Glass for industrial automation: Technology study from Beckhoff,video,http://youtu.be/8o2TkYGCgUQ,2013-12-18 12:33:57,13,0,8
beckhoff,119761528047992_693778993979573,EK9300: The flexible gateway between different worlds of control,EK9300: The flexible gateway between different worlds of control,link,http://www.beckhoff.com/english/press/pr2413.htm,2013-12-13 14:37:38,7,0,1
beckhoff,119761528047992_692434037447402,CP32xx Panel PC: Multi-touch functionality and high-end computing power all in one dynamic machine controller,CP32xx Panel PC: Multi-touch functionality and high-end computing power all in one dynamic machine c,link,http://www.beckhoff.com/english/press/pr2713.htm,2013-12-10 16:15:40,16,0,5
beckhoff,119761528047992_692433997447406,"CX5100 Embedded PC series: Fanless compact controller with single, dual or quad-core Atom™ CPU","CX5100 Embedded PC series: Fanless compact controller with single, dual or quad-core Atom™ CPU",link,http://www.beckhoff.com/english/press/pr2613.htm,2013-12-10 16:15:29,10,0,2
beckhoff,119761528047992_687237514633721,"Beckhoff Trade Show TV: Day 3 from SPS IPC Drives 2013 in Nuremberg. Topics: TwinCAT 3.1, Open Control Technology, Google Glass for Automation, eXtended Transport System.","SPS IPC Drives 2013, Day 3: Beckhoff Trade Show TV",video,http://www.youtube.com/watch?v=ZoDVg7xGEjM,2013-11-29 15:55:58,13,1,6
beckhoff,119761528047992_687234367967369,,EL6201 AS-Interface master terminal supports specification 3.0,link,http://www.beckhoff.com/english/press/news1713.htm,2013-11-29 15:46:44,3,0,1
beckhoff,119761528047992_686716991352440,"Beckhoff Trade Show TV: Day 2 from SPS IPC Drives 2013 in Nuremberg. Topics: Universal Multi-Touch Portfolio, CP27xx and CP32xx Panel PCs, ET EtherCAT Terminals, 10 Years EtherCAT Technology Group, EtherCAT-based XTS / KUKA application.","SPS IPC Drives 2013, Day 2: Beckhoff Trade Show TV",video,http://youtu.be/CagWmk7d4xg,2013-11-28 15:05:25,12,0,2
beckhoff,119761528047992_686144714743001,"Beckhoff Trade Show TV: Day 1 from SPS IPC Drives 2013 in Nuremberg. Topics: New Processor Generations, CX5100 Embedded PC, Servo Terminals, Industry 4.0.","SPS IPC Drives 2013, Day 1: Beckhoff Trade Show TV",video,http://www.youtube.com/watch?v=RINnhuTC3B4,2013-11-27 13:40:10,13,0,3
beckhoff,119761528047992_686115484745924,,SPS IPC Drives 2013: ‘Google Glass’ in industrial applications as a supplement for machine operation,link,http://www.beckhoff.com/english/press/news1613.htm,2013-11-27 12:26:22,11,1,5
beckhoff,119761528047992_680941028596703,,"Interview with Hans Beckhoff – ""Social Automation for Industrie 4.0""",link,http://www.pc-control.net/pdf/042013/interview/pcc_0413_interview_e.pdf,2013-11-18 16:24:14,11,1,4
beckhoff,119761528047992_680935555263917,,Scientific Automation drives convergence of control technology with measurement technology,link,http://www.pc-control.net/pdf/032013/products/pcc_0313_scientific_e.pdf,2013-11-18 16:08:05,7,0,2
beckhoff,119761528047992_677678255589647,,Building automation in the new ”Vienna Hot Spring”,link,http://www.pc-control.net/pdf/022013/solutions/pcc_0213_therme-wien_e.pdf,2013-11-12 12:15:32,4,0,1
beckhoff,119761528047992_677678218922984,,Scientific Automation drives convergence of control technology with measurement technology,link,http://www.pc-control.net/pdf/032013/products/pcc_0313_scientific_e.pdf,2013-11-12 12:15:27,5,0,1
beckhoff,119761528047992_670879302936209,,Scientific Automation drives convergence of control technology with measurement technology,link,http://www.pc-control.net/pdf/032013/products/pcc_0313_scientific_e.pdf,2013-10-29 16:02:40,7,2,3
beckhoff,119761528047992_667125823311557,,PC Control and EtherCAT automate pipette-tip injection molding machine: Twice the throughput in half,link,http://www.pc-control.net/pdf/032013/solutions/pcc_0313_hekuma_e.pdf,2013-10-22 14:05:45,6,0,2
beckhoff,119761528047992_666628616694611,,Retrofitting plastic blow molding machines: From extruder to wall thickness control,link,http://www.pc-control.net/pdf/032013/solutions/pcc_0313_mueller_e.pdf,2013-10-21 11:43:51,4,0,1
beckhoff,119761528047992_664961156861357,,Compact multi-touch Panel PC with ARM processor,link,http://www.beckhoff.com/english/press/pr2113.htm,2013-10-18 09:10:19,10,1,0
beckhoff,119761528047992_664961140194692,,XMold: The new system solution for high precision in injection molding,link,http://www.beckhoff.com/english/press/pr2213.htm,2013-10-18 09:10:14,6,0,0
beckhoff,119761528047992_660766093947530,,10 years of EtherCAT – the Ethernet fieldbus from Beckhoff,link,http://www.pc-control.net/pdf/032013/special/pcc_0313_10_years_ethercat_e.pdf,2013-10-11 12:24:32,14,0,3
beckhoff,119761528047992_613670755346145,,K 2013: Higher precision and productivity through servo-electric drive technology,link,http://www.beckhoff.com/english/beckhoff/trade_show_k.htm,2013-10-08 09:58:37,8,1,0
beckhoff,119761528047992_657749514249188,,Interview: PC Control opens the way to improved efficiency and quality in plastics processing,link,http://www.pc-control.net/pdf/032013/interview/pcc_0313_interview_tkosthorst_e.pdf,2013-10-04 16:36:14,3,0,0
beckhoff,119761528047992_656661314358008,,About FachPack 2013:,link,http://www.beckhoff.com/english/beckhoff/trade_show_impressions_fachpack2013.htm,2013-10-02 08:00:14,4,0,1
beckhoff,119761528047992_656661311024675,,Motek 2013: Modular control concepts for modular assembly lines,link,http://www.beckhoff.com/english/beckhoff/trade_show_motek.htm,2013-10-02 08:00:13,6,0,1
beckhoff,119761528047992_652966411394165,,About EMO 2013: PC- and EtherCAT-based Control meets increasing requirements in metalworking,link,http://www.beckhoff.com/english/beckhoff/trade_show_impressions_emo2013.htm,2013-09-25 13:23:43,5,1,0
beckhoff,119761528047992_652966391394167,,"Tower 185 in Frankfurt: Intelligent building automation manages 60,000 data points",link,http://www.pc-control.net/pdf/022013/solutions/pcc_0213_tower185_e.pdf,2013-09-25 13:23:41,8,0,3
beckhoff,119761528047992_649359895088150,,IP 67 I/O system: EP3744 differential pressure measuring box,link,http://www.beckhoff.com/english/press/pr1913.htm,2013-09-18 11:09:19,9,0,2
beckhoff,119761528047992_648897001801106,,FachPack 2013: PC-Control for all packaging machines – Flexibly scalable up to the high-end machine,link,http://www.beckhoff.com/english/beckhoff/trade_show_fachpack.htm,2013-09-17 14:27:14,4,0,1
beckhoff,119761528047992_648896968467776,,PC-Control as the basis for high-performance and cost-efficient packaging machines,link,http://www.pc-control.net/pdf/032013/interview/pcc_0313_interview_fwuerthner_e.pdf,2013-09-17 14:27:09,4,0,2
beckhoff,119761528047992_645413138816159,,EMO 2013: The compact high-performance CNC from Beckhoff – PC-based control on the DIN rail,link,http://www.beckhoff.com/english/beckhoff/trade_show_emo.htm,2013-09-10 09:08:48,8,0,0
beckhoff,119761528047992_643714735652666,,EMO 2013: The open CNC architecture with TwinCAT 3,link,http://www.pc-control.net/pdf/032013/products/pcc_0313_cnc_architecture_e.pdf,2013-09-06 14:22:29,5,0,1
beckhoff,119761528047992_642347682456038,,Vaillant Group sets high standards in quality optimisation,link,http://www.pc-control.net/pdf/022013/solutions/pcc_0213_vaillant_e.pdf,2013-09-03 15:52:08,10,1,1
beckhoff,119761528047992_638587232832083,,"Aixcon Powersystems: PC Control and EtherCAT as the basis for optimised control technology in 30,000",link,http://www.pc-control.net/pdf/012013/solutions/pcc_0113_aixcon_e.pdf,2013-08-27 09:58:06,8,0,2
beckhoff,119761528047992_636727099684763,,Building Automation in the “Zukunftsmeile Fürstenallee” research and development cluster,link,http://www.pc-control.net/pdf/022013/solutions/pcc_0213_cover_e.pdf,2013-08-23 08:47:11,6,0,1
beckhoff,119761528047992_635324486491691,,Quickly find the right component: Using the Beckhoff Product Finder,link,http://www.beckhoff.com/english/productfinder/default.htm,2013-08-20 07:53:50,8,0,2
beckhoff,119761528047992_632363686787771,,Farsighted personnel policy: Beckhoff Group employs 98 students,link,http://www.beckhoff.com/english/press/news1213.htm,2013-08-14 14:06:22,9,0,0
beckhoff,119761528047992_629457030411770,,Second Beckhoff Asia Pacific Sales Meeting in Singapore,link,http://www.beckhoff.com/english/press/news1113.htm,2013-08-08 12:51:09,11,1,1
beckhoff,119761528047992_625574744133332,,Industry 4.0: Realization today with proven control architectures,link,http://www.pc-control.net/pdf/022013/products/pcc_0213_industrie-4.0_e.pdf,2013-07-30 16:00:17,9,0,0
beckhoff,119761528047992_623258357698304,CP-Link 4 - The One Cable Display Link. The optimum solution for remote operator interface units located up to 100 m away.,CP-Link 4 - The One Cable Display Link,video,http://www.youtube.com/watch?v=bFdDw3O0nnY,2013-07-25 11:50:00,16,0,0
beckhoff,119761528047992_620092414681565,,Customer-specific Control Panels: Three development levels for the individual operating terminal,link,http://www.pc-control.net/pdf/022013/products/pcc_0213_control-panel_e.pdf,2013-07-18 15:27:10,5,0,0
beckhoff,119761528047992_616463505044456,,DALI light management at Zayed University in Abu Dhabi,link,http://www.pc-control.net/pdf/012013/solutions/pcc_0113_tridonic_e.pdf,2013-07-10 11:14:30,6,0,2
beckhoff,119761528047992_613349962022477,,CX8093 Embedded PC with optional virtual device can be used as a 2-in-1 PROFINET device,link,http://www.beckhoff.com/english/press/pr1313.htm,2013-07-03 14:08:10,6,0,1
beckhoff,119761528047992_609935272363946,,Open control technology: TwinCAT links existing machine control from PARI Pharma with SAP system,link,http://www.pc-control.net/pdf/012013/solutions/pcc_0113_pari_e.pdf,2013-06-25 11:10:16,8,0,1
beckhoff,119761528047992_605426182814855,,Beckhoff technology ensures that show flows smoothly at the premiere of the “Sensation 2012”,link,http://www.pc-control.net/pdf/012013/solutions/pcc_0113_statecore_e.pdf,2013-06-14 11:32:39,7,0,2
beckhoff,119761528047992_604964986194308,Video: PC-based Control for Stage and Show Technology - the universal platform for all systems,PC-based Control for Stage and Show Technology,video,http://www.youtube.com/watch?v=jAHrCzbZM4g,2013-06-13 14:26:07,6,0,1
beckhoff,119761528047992_602186059805534,,New 4000 m² building sets the course for further growth,link,http://www.beckhoff.com/english/press/news0813.htm,2013-06-07 13:16:09,13,0,3
beckhoff,119761528047992_597664850257655,,PC-based Control: Assembly line from Küster produces more than 1 million electronic parking brakes p,link,http://www.pc-control.net/pdf/012013/solutions/pcc_0113_kuester_e.pdf,2013-05-28 15:10:25,8,0,3
beckhoff,119761528047992_595274190496721,,EtherCAT in a tidal turbine,link,http://www.pc-control.net/pdf/012013/solutions/pcc_0113_scotrenewables_e.pdf,2013-05-23 13:14:20,9,0,1
beckhoff,119761528047992_591465490877591,,"„Kinetic Rain“ – EtherCAT synchronises the movement of 1,216 servo axes in Changi Airport in Singapo",link,http://www.pc-control.net/pdf/012013/solutions/pcc_0113_cover_e.pdf,2013-05-14 15:06:13,15,3,4
beckhoff,119761528047992_588143844543089,,CP-Link 4 – The One Cable Display Link,link,http://www.beckhoff.com/english/highlights/cplink4/default.htm,2013-05-06 09:57:07,8,0,1
beckhoff,119761528047992_586416608049146,,The open control architecture for maximum flexibility in woodworking,link,http://www.beckhoff.com/english/beckhoff/trade_show_ligna.htm,2013-05-02 08:40:50,10,0,2
beckhoff,119761528047992_584643054893168,,10 years of EtherCAT: Worldwide standard celebrates its anniversary,link,http://www.beckhoff.com/english/press/news0513.htm,2013-04-29 07:22:38,8,0,4
beckhoff,119761528047992_581151428575664,,Higher signal variety in a flexible compact solution,link,http://www.beckhoff.com/english/press/pr0713.htm,2013-04-23 10:08:25,6,0,1
beckhoff,119761528047992_141981395984739,"Beckhoff Trade Show TV from day 4 at Hannover Messe 2013 in Hanover, Germany. Topics: TwinCAT 3.1 release, I/O news, multi-touch panel.","EN | Hannover Messe 2013, Day 4: Beckhoff Trade Show TV",video,http://www.youtube.com/watch?v=wUxf6KUzwTk,2013-04-12 08:22:03,9,2,1
beckhoff,119761528047992_371844602924067,"Beckhoff Trade Show TV from day 3 at Hannover Messe 2013 in Hanover, Germany. Topics include: XTS - eXtended Transport System, 10 years of EtherCAT.","EN | Hannover Messe 2013, day 3: Beckhoff Trade Show TV",video,http://www.youtube.com/watch?v=ywmQyAK0HKo,2013-04-12 07:28:26,14,1,0
beckhoff,119761528047992_197373203719986,"Beckhoff Trade Show TV from day 2 at Hannover Messe 2013 in Hanover, Germany. Topics: Visit of Dr. Rösler, Federal Minister of Economics and Technology, solutions for the wind industry, metropolitan solutions, Beckhoff at partner booths.","EN | Hannover Messe 2013, day 2: Beckhoff Trade Show TV",video,http://www.youtube.com/watch?v=hfRAd3reKow,2013-04-12 07:19:26,15,0,1
beckhoff,119761528047992_554325811256262,"Beckhoff Trade Show TV from day 1 at Hannover Messe 2013 in Hanover, Germany. Topics: Industry 4.0, CP-Link 4 – The One Cable Display Link, Motion news, EtherCAT Box, TectoYou.","EN | Hannover Messe 2013, day 1: Beckhoff Trade Show TV",video,http://www.youtube.com/watch?v=HQ4DEDNrfTs,2013-04-10 11:25:26,21,0,0
beckhoff,119761528047992_414269012001568,PC Control as the basis for Industry 4.0 – Learn more at Hannover Messe 2013,Beckhoff at Hannover Messe 2013,link,http://www.beckhoff.com/hmi,2013-04-03 08:41:07,14,1,0
beckhoff,119761528047992_570555276301946,,Hannover Messe 2013: release of TwinCAT 3.1 – Further new features for eXtended Automation,link,http://www.beckhoff.com/english/beckhoff/trade_show_hmi.htm,2013-03-28 13:20:04,13,0,0
beckhoff,119761528047992_567428763281264,,Hannover Messe 2013: 10 x New Automation Technology from Beckhoff,link,http://www.beckhoff.com/english/beckhoff/trade_show_hmi.htm,2013-03-21 10:05:51,11,1,0
beckhoff,119761528047992_564695393554601,,PLS 2013: PC-based Control for stage and show technology,link,http://www.beckhoff.com/english/beckhoff/trade_show_prolight_sound.htm,2013-03-14 15:45:19,7,0,0
beckhoff,119761528047992_561176013906539,,ISH 2013: From HVAC to room automation – Beckhoff building automation as the basis for energy-efficient building operation,link,http://www.beckhoff.com/english/beckhoff/trade_show_ish.htm,2013-03-07 14:08:04,8,1,0
beckhoff,119761528047992_553882734635867,,Video – EK1960 TwinSAFE Compact Controller integrates safety functions in a compact housing,link,http://www.beckhoff.com/english/highlights/ek1960/default.htm,2013-02-20 16:40:34,8,1,0
beckhoff,119761528047992_550590721631735,,Extended servomotor range: new motor series with increased rotor moment of inertia,link,http://www.beckhoff.com/english/drive_technology/am85xx.htm,2013-02-13 11:53:19,10,1,1
beckhoff,119761528047992_547943658563108,,New EtherCAT and Bus Terminal: Digital output terminal with eight 2 A channels in HD housing,link,http://www.beckhoff.com/english/ethercat/el2828.htm,2013-02-07 16:59:22,8,1,0
beckhoff,119761528047992_546965435327597,,PC-Control for rubber and tire production,link,http://download.beckhoff.com/download/Document/catalog/Beckhoff_Rubber_Tire_2013.pdf,2013-02-05 14:06:01,4,0,0
beckhoff,119761528047992_540501052640702,,Tire Technology Expo 2013: Robust automation technology for the tire and rubber industries,link,http://www.beckhoff.com/english/beckhoff/trade_show_tiretech.htm,2013-01-29 16:34:34,3,0,0
beckhoff,119761528047992_537862596237881,,Deep drawing press convinces with speed and energy efficiency with PC-based Control,link,http://www.pc-control.net/pdf/032012/solutions/pcc_0312_kiermar_technology_e.pdf,2013-01-24 14:35:32,9,0,0
beckhoff,119761528047992_472144686180637,The new AM8000 servomotor from Beckhoff integrates the feedback system into one standard motor cable.,AM8000 servomotors with One Cable Technology from Beckhoff,video,http://www.youtube.com/watch?v=qgb1M3LeE9k,2013-01-23 12:43:09,14,1,5
beckhoff,119761528047992_114778378698252,The Beckhoff Automation YouTube channel offers more than 160 videos about latest technologies and products.,YouTube - Beckhoff Automation,link,http://www.youtube.com/user/BeckhoffAutomation?view&feature,2013-01-16 14:09:25,16,3,3
beckhoff,119761528047992_533444013346406,,Compact servo terminal supports One Cable Technology equipped AM8000 motors,link,http://www.beckhoff.com/english/ethercat/el7201_0010.htm,2013-01-15 16:20:33,6,0,0
beckhoff,119761528047992_491966954180575,Application example: Bottling plant with eXtended Transport System (XTS) from Beckhoff.,XTS application example: Bottling plant,video,http://www.youtube.com/watch?v=cZJyLd_WpZg,2013-01-11 15:58:58,18,1,1
