company,status_id,status_message,link_name,status_type,status_link,status_published,likes,comments,shares
beckhoff,119761528047992_522116221132506,TwinSAFE Controller integrates safety functions in a compact housing: Safety controller for small to medium-sized applications.,EK1960 TwinSAFE Compact Controller from Beckhoff,video,http://www.youtube.com/watch?v=4LPYRDq-DL4,2012-12-20 12:23:56,8,2,0
beckhoff,119761528047992_384611954965732,Beckhoff servo terminal supports One Cable Technology (OCT). With OCT power and feedback signals are combined in one standard motor cable.,Servo terminal with One Cable Technology from Beckhoff,video,http://www.youtube.com/watch?v=lKrmvQ5qOq4,2012-12-19 13:40:22,13,0,1
beckhoff,119761528047992_519921448031996,,XTS for highly dynamic machine concepts: simplified engineering with TwinCAT,link,http://www.pc-control.net/pdf/042012/products/pcc_0412_xts_e.pdf,2012-12-18 09:37:03,5,0,0
beckhoff,119761528047992_514713928552748,,„Hygienic Design“ – Beckhoff offers complete stainless steel solution for high hygiene requirements,link,http://www.beckhoff.com/english/highlights/stainless-steel/default.htm,2012-12-07 15:03:34,9,3,0
beckhoff,119761528047992_513702198653921,,Beckhoff Automation UpDate South-East Asia: Great interest in PC-based control technology,link,http://www.beckhoff.com/english.asp?press%2Fnews1012.htm,2012-12-05 07:50:01,2,0,0
beckhoff,119761528047992_302983369802868,"Beckhoff Trade Show TV: Day 3 at SPS IPC Drives 2012 in Nuremberg, Germany. Topics: multi-touch panel construction kit, push-button extensions, TwinCAT 3.1, Visual Studio 2012, Windows 8.","SPS IPC Drives 2012, Day 3: Beckhoff Trade Show TV",video,http://www.youtube.com/watch?v=nWCTQKY8s0g,2012-11-30 08:32:28,8,1,0
beckhoff,119761528047992_121978247961733,"Beckhoff Trade Show TV: Day 2 at SPS IPC Drives 2012 in Nuremberg, Germany. Topics: XTS (eXtended Transport System), servo terminal with One Cable Technology, I/O news.","EN | SPS IPC Drives 2012, Day 2: Beckhoff Trade Show TV",video,http://www.youtube.com/watch?v=3eyPvdTOuHc,2012-11-29 08:55:50,10,0,1
beckhoff,119761528047992_507976132568903,"Beckhoff Trade Show TV: Day 1 at SPS IPC Drives 2012 in Nuremberg, Germany. Topics: Servomotors, Embedded PCs, TwinSAFE Compact Controller.","SPS IPC Drives 2012, Day 1: Beckhoff Trade Show TV",video,http://www.youtube.com/watch?v=lxuSOaj5SWQ,2012-11-28 08:58:45,11,1,2
beckhoff,119761528047992_508761762481298,,EtherCAT: Ultra-fast wind farm networking with reaction times of less than 1 ms enables early diagnosis of voltage drops,link,http://www.pc-control.net/pdf/special_wind_2012/pcc_special_wind_2012_real_time_network_e.pdf,2012-11-23 16:36:02,4,0,0
beckhoff,119761528047992_508668689157272,,PC Control 04'12 is online,link,http://www.pc-control.net/english,2012-11-23 10:48:02,2,0,0
beckhoff,119761528047992_502095299814611,,Safety over EtherCAT as the basis for plant-wide safety architectures,link,http://www.pc-control.net/pdf/032012/products/pcc_0312_safety_over_ethercat_e.pdf,2012-11-07 14:26:02,5,0,0
beckhoff,119761528047992_497994016891406,,Higher flexibility: New Embedded PC generation for all control tasks,link,http://www.beckhoff.com/english/highlights/cx2000/default.htm,2012-10-29 08:41:03,6,1,0
beckhoff,119761528047992_493330194024455,,PC- and EtherCAT-based Control – The standard for metal forming at EuroBlech 2012,link,http://www.beckhoff.com/english/beckhoff/euroblech.htm,2012-10-18 10:32:34,4,0,0
beckhoff,119761528047992_490838207606987,,Slotbox for extending Industrial PCs with 2 plug-in cards slots,link,http://www.beckhoff.com/english.asp?industrial_pc%2Fc9900_e2xx.htm,2012-10-12 14:12:17,6,1,0
beckhoff,119761528047992_489987804358694,,“The winds of openness blow in all directions” – Dirk Kordtomeikel in an interview with the openautomation,link,http://www.pc-control.net/pdf/special_wind_2012/pcc_special_wind_2012_interview_e.pdf,2012-10-10 14:36:34,6,0,0
beckhoff,119761528047992_486573128033495,,Motek 2012: XTS – higher flexibility and lower engineering effort for handling and assembly,link,http://www.beckhoff.com/english.asp?beckhoff%2FMotek.htm,2012-10-02 11:16:18,5,0,0
beckhoff,119761528047992_484133944944080,,XTS – Revolutionary Drive Technology enabled by EtherCAT,link,http://www.pc-control.net/pdf/032012/products/pcc_0312_xts_ethercat_e.pdf,2012-09-26 15:50:03,6,0,0
beckhoff,119761528047992_481994311824710,,PC Control 03'12 is online,link,http://www.pc-control.net/english.htm,2012-09-21 10:00:33,6,0,0
beckhoff,119761528047992_481994305158044,,PC Control Wind Special,link,http://www.pc-control.net/english/special_wind_2012/home.htm,2012-09-21 10:00:32,3,0,0
beckhoff,119761528047992_480981148592693,,FachPack 2012: Optimised flow of material in packaging technology – saving mechanical costs with XTS,link,http://www.beckhoff.com/english.asp?beckhoff%2Ffachpack.htm,2012-09-18 14:27:09,4,0,0
beckhoff,119761528047992_478684868822321,,EU PVSEC 2012: Open automation solutions for the photovoltaic production,link,http://www.beckhoff.com/english.asp?beckhoff%2Feupvsec.htm,2012-09-12 10:44:05,6,1,0
beckhoff,119761528047992_476760932348048,,Husum Wind 2012: control of wind turbines with even greater efficiency,link,http://www.beckhoff.com/english/press/pr2712.htm,2012-09-07 09:25:20,5,0,0
beckhoff,119761528047992_476044682419673,,"Reduced hardware costs, higher availability – and all on a single platform",link,http://www.beckhoff.com/english.asp?beckhoff%2Fhusumwind.htm,2012-09-05 10:43:05,5,0,0
beckhoff,119761528047992_473671279323680,,"Beckhoff presents at SMM in Hamburg, Germany, from 04. – 07.09.2012, its universal automation toolkit for shipbuilding: open, flexible, modular",link,http://www.beckhoff.com/english.asp?beckhoff%2Fsmm.htm,2012-08-30 07:33:18,6,1,0
beckhoff,119761528047992_471421212882020,,Windows 8 – The Embedded Edition as “Technical Preview”,link,http://www.pc-control.net/pdf/022012/pcc_0212_windows8_e.pdf,2012-08-24 10:17:02,4,0,0
beckhoff,119761528047992_468902786467196,,All in one: Integration of measurement and safety technology in the control system,link,http://www.pc-control.net/pdf/012012/pcc_0112_vms_e.pdf,2012-08-17 06:15:03,3,0,0
beckhoff,119761528047992_468216139869194,,Beckhoff opens new subsidiary in Hungary,link,http://www.pc-control.net/pdf/022012/pcc_0212_news_ungarn_e.pdf,2012-08-15 08:57:34,5,0,0
beckhoff,119761528047992_466498116707663,,"AM8000: Dynamic, durable and efficient",link,http://www.pc-control.net/pdf/022012/pcc_0212_interview_e.pdf,2012-08-10 12:51:02,2,0,0
beckhoff,119761528047992_465782196779255,,Smart Grid meets PC-based Control,link,http://www.pc-control.net/pdf/012012/pcc_0112_enms_e.pdf,2012-08-08 15:35:18,2,0,0
beckhoff,119761528047992_463493740341434,,Perfection in a box: bag-in-box foodstuff packaging,link,http://www.pc-control.net/pdf/012012/pcc_0112_pattyn_e.pdf,2012-08-02 13:47:03,3,0,0
beckhoff,119761528047992_461278620562946,,EtherCAT Box modules in a stainless steel finish for Hygienic Design applications,link,http://www.pc-control.net/pdf/022012/pcc_0212_eqxxxx_e.pdf,2012-07-27 10:56:34,1,0,0
beckhoff,119761528047992_458700487487426,,Fully automatic welding robots ensure greater productivity and profitability,link,http://www.pc-control.net/pdf/012012/pcc_0112_arcspecialties_e.pdf,2012-07-20 08:41:04,3,0,0
beckhoff,119761528047992_427477787304296,More possibilities on the DIN rail: CX2000 Embedded PC with multi-core CPU and PCI Express.,EN | CX2000 Embedded PC from Beckhoff,video,http://www.youtube.com/watch?v=wkiBSYSRC4w,2012-07-17 14:17:15,4,0,4
beckhoff,119761528047992_457297380961070,,BACnet: scalable performance and wide range of functions,link,http://www.pc-control.net/pdf/022012/pcc_0212_bacnet_e.pdf,2012-07-16 14:10:02,2,0,0
beckhoff,119761528047992_460476083976988,Multi-touch Panel series for maximum flexibility,EN | Multi-touch Panel series from Beckhoff,video,http://www.youtube.com/watch?v=RsxmvgR2R5g,2012-07-12 08:23:10,4,0,5
beckhoff,119761528047992_455521217805353,,Interview with Erwin Fertig: Highly dynamic servomotors from our in-house production,link,http://www.pc-control.net/pdf/012012/pcc_0112_interview_e.pdf,2012-07-11 13:42:24,3,0,0
beckhoff,119761528047992_452711648086310,,New Zealand: Beckhoff expands its international presence,link,http://www.pc-control.net/pdf/022012/pcc_0212_beckhoff_neuseeland_e.pdf,2012-07-04 14:50:39,1,0,0
beckhoff,119761528047992_452711621419646,,PC Control 02'12 is online,link,http://www.pc-control.net/english.htm,2012-07-04 14:50:36,2,0,0
beckhoff,119761528047992_448076751883133,,Efficient engineering with TwinCAT 3,link,http://www.pc-control.net/pdf/012012/pcc_0112_twincat3_e.pdf,2012-06-26 11:04:33,2,0,0
beckhoff,119761528047992_490310127652199,"XTS. eXtended Transport System. Product presentation from Uwe Prüßmeier, XTS product manager.",EN | XTS. eXtended Transport System.,video,http://www.youtube.com/watch?v=TMyXBI70SCw,2012-06-26 08:32:25,1,0,0
beckhoff,119761528047992_445094645514677,,Precise resistance bridge evaluation in the EtherCAT I/O system,link,http://www.beckhoff.com/english.asp?ethercat%2Fel3356_0010.htm,2012-06-21 07:15:02,0,0,0
beckhoff,119761528047992_444007638956711,,Maximum precision and high-speed in production of profiles,link,http://www.pc-control.net/pdf/012012/pcc_0112_thalmann_e.pdf,2012-06-19 10:09:02,2,0,0
beckhoff,119761528047992_406422856076230,Compact room controller is modularly extendable,EN | Compact BC9191 room controller from Beckhoff,video,http://www.youtube.com/watch?v=sv5XZO5ODJA,2012-06-19 09:31:16,6,0,1
beckhoff,119761528047992_441378599219615,,Beckhoff USA: a success story,link,http://www.pc-control.net/pdf/012012/pcc_0112_interview_usa_e.pdf,2012-06-14 15:11:02,0,0,0
beckhoff,119761528047992_118407858299544,CX8000 Embedded PC: Powerful 32-bit controller with integrated fieldbus and I/O interface,EN | CX8000 Embedded PC from Beckhoff: PC Control redefines small controllers,video,http://www.youtube.com/watch?v=MpZRhNAB5CY,2012-06-14 15:07:50,3,0,0
beckhoff,119761528047992_439566729400802,,Beckhoff extends its range of EtherCAT infrastructure components,link,http://www.beckhoff.com/english.asp?press%2Fpr1912.htm,2012-06-11 10:17:02,2,0,0
beckhoff,119761528047992_436910976333044,,DLR: How much power does sunlight hold?,link,http://www.pc-control.net/pdf/012012/pcc_0112_dlr_e.pdf,2012-06-06 10:16:18,2,0,0
beckhoff,119761528047992_230839077033732,XTS. eXtended Transport System. The Linear Transport System from Beckhoff.,EN | XTS. The Linear Transport System from Beckhoff.,video,http://www.youtube.com/watch?v=GQsnjFTG26U,2012-06-06 09:45:10,9,0,3
beckhoff,119761528047992_436381383052670,,Fast Hot Connect: faster tool change increases productivity,link,http://www.beckhoff.com/english.asp?press%2Fpr2012.htm,2012-06-05 13:58:02,2,0,0
beckhoff,119761528047992_433716469985828,,XFC: ultra-fast performance using standard components,link,http://www.beckhoff.com/english.asp?highlights%2Fxfc%2Fethercat-plc-12.5-microseconds.htm,2012-06-01 13:17:34,10,0,0
beckhoff,119761528047992_432490530108422,,EtherCAT Box – new stainless steel modules with IP 69K protection for direct use on machines,link,http://www.beckhoff.com/english.asp?press%2Fpr2112.htm,2012-05-30 14:23:02,5,0,0
beckhoff,119761528047992_428541333836675,,Drive Technology – Rethought.,link,http://www.beckhoff.com/english/highlights/xts/default.htm,2012-05-24 06:44:18,5,0,0
beckhoff,119761528047992_422991957724946,,Worldwide Beckhoff Sales meets for the International Sales Meeting,link,http://www.beckhoff.com/english/press/news0412.htm,2012-05-15 10:27:02,4,0,0
beckhoff,119761528047992_422914494399359,,Automatica 2012: PC-based Control – Efficient integration of robot kinematics in standard control systems,link,http://www.beckhoff.com/english.asp?beckhoff%2Fautomatica.htm,2012-05-15 06:13:18,3,0,0
beckhoff,119761528047992_418546278169514,,Highly flexible – The new multi-touch panel generation,link,http://www.pc-control.net/pdf/012012/pcc_0112_cover_e.pdf,2012-05-08 10:08:33,7,0,0
beckhoff,119761528047992_415190098505132,,"Ifat 2012: Optimisation of water management systems with precise, high-performance controllers.",link,http://www.beckhoff.com/english.asp?beckhoff%2Fifat.htm,2012-05-03 09:37:20,4,0,0
beckhoff,119761528047992_411945728829569,,Drupa 2012: Optimum use of processor power: with Scientific Automation for the printing industry,link,http://www.beckhoff.com/english.asp?beckhoff%2Fdrupa.htm,2012-04-30 10:57:37,6,0,0
beckhoff,119761528047992_293066170776642,Beckhoff Trade Show TV: Day 4 at Hannover Messe 2012.,EN | Beckhoff Trade Show TV | Day 4 at Hannover Messe 2012,video,http://www.youtube.com/watch?v=cJfHjHykPKo&feature=plcp,2012-04-27 11:07:22,2,0,1
beckhoff,119761528047992_343649205695592,Beckhoff Trade Show TV: Day 3 at Hannover Messe 2012.,EN | Beckhoff Trade Show TV | Day 3 at Hannover Messe 2012,video,http://www.youtube.com/watch?v=8MIFy9_74qg,2012-04-27 07:48:42,5,0,2
beckhoff,119761528047992_239154349525781,Beckhoff Trade Show TV: Day 2 at Hannover Messe 2012.,EN | Beckhoff Trade Show TV: Day 2 at Hannover Messe 2012,video,http://www.youtube.com/watch?v=pVVRCUCcd6A,2012-04-25 14:08:27,5,0,1
beckhoff,119761528047992_373985312643422,Beckhoff Trade Show TV: Day 1 at Hannover Messe 2012.,EN | Beckhoff Trade Show TV: Day 1 at Hannover Messe 2012,video,http://www.youtube.com/watch?v=85wftCWW-Qw,2012-04-24 14:43:03,14,1,4
beckhoff,119761528047992_403814722976003,,Balance 2011: Turnover increases by 34 % to 465 million Euros,link,http://www.beckhoff.com/english.asp?press%2Fpr1812.htm,2012-04-19 14:33:09,3,0,0
beckhoff,119761528047992_403814672976008,,Despatch advances photovoltaic production with innovative control technology,link,http://www.pc-control.net/pdf/042011/pcc_0411_despatch_e.pdf,2012-04-19 14:33:06,2,0,0
beckhoff,119761528047992_401150366575772,,"Beckhoff at Hannover Messe, between 23. – 27.04.2012, in Hall 9, Booth F06",link,http://www.beckhoff.com/english.asp?beckhoff%2Fhmi.htm,2012-04-16 17:25:05,2,0,0
beckhoff,119761528047992_395962327094576,,Directly connect a servomotor and resolver to a 12 mm wide Bus Terminal.,link,http://www.beckhoff.com/english.asp?highlights%2Fel7201%2Fdefault.htm,2012-04-10 14:30:04,4,0,0
beckhoff,119761528047992_392705250753617,,State-of-the-art energy and space management in Austria’s Ferry Porsche Congress Center,link,http://www.pc-control.net/pdf/012012/pcc_0112_ferry_porsche_center_e.pdf,2012-04-05 11:11:18,4,0,0
beckhoff,119761528047992_391511057539703,,Making optimum use of processor power: with Scientific Automation for the printing industry,link,http://www.beckhoff.com/english/press/pr1212.htm,2012-04-03 13:13:02,2,0,0
beckhoff,119761528047992_390865544270921,,PC-based Control: Integration of robot kinematics in the standard control system,link,http://www.beckhoff.com/english.asp?press%2Fpr1112.htm,2012-04-02 14:29:02,1,0,0
beckhoff,119761528047992_388939144463561,,Light + Building 2012: Beckhoff Building Automation – maximum energy efficiency for new and modernised buildings.,link,http://www.beckhoff.com/english.asp?beckhoff%2Flight_building.htm,2012-03-30 12:06:24,4,0,0
beckhoff,119761528047992_383257075031768,,"Anuga FoodTec 2012, Cologne| Germany: reduce the footprint, increase energy efficiency",link,http://www.beckhoff.com/english.asp?beckhoff%2Fanuga_foodtec.htm,2012-03-21 14:38:03,1,0,0
beckhoff,119761528047992_382665665090909,,PC-based Control for show and stage technology,link,http://download.beckhoff.com/download/Document/catalog/Beckhoff_stage_technology.pdf,2012-03-20 15:50:03,0,0,0
beckhoff,119761528047992_381926331831509,,"Fensterbau/Frontale 2012, Nuremberg | Germany: PC-based Control for window, door and facade production process",link,http://www.beckhoff.com/english.asp?beckhoff%2Ffensterbau_frontale.htm,2012-03-19 11:29:03,3,0,0
beckhoff,119761528047992_379508752073267,,"Food & Beverage: reduce the footprint, increase energy efficiency",link,http://www.beckhoff.com/english.asp?press%2Fpr0712.htm,2012-03-15 14:10:03,1,0,0
beckhoff,119761528047992_378827715474704,,Precise measurement with EtherCAT Terminal,link,http://www.beckhoff.com/english.asp?ethercat%2Fel3255.htm,2012-03-14 11:54:20,1,0,0
beckhoff,119761528047992_374153102608832,,"Prolight + Sound 2012, Frankfurt | Germany: PC-based Control for stage and show technology",link,http://www.beckhoff.com/english.asp?beckhoff%2Fprolight_sound.htm,2012-03-07 10:09:03,1,0,0
beckhoff,119761528047992_369592729731536,,All-in-one stepper motor terminal permits direct connection of powerful stepper motors up to 8 A,link,http://www.beckhoff.com/english/press/pr0612.htm,2012-02-29 08:35:02,0,0,0
beckhoff,119761528047992_368997563124386,,New ‘hygienic design’ AM8800 stainless steel servomotor series,link,http://www.beckhoff.com/english/press/pr2711.htm,2012-02-28 12:28:03,0,0,0
beckhoff,119761528047992_360588210627873,Integrated power measurement and monitoring in the EtherCAT I/O system,EN | Integrated power measurement in the EtherCAT I/O system,video,http://www.youtube.com/watch?v=X3b6IupINPM,2012-02-28 10:29:21,3,0,4
beckhoff,119761528047992_366460906711385,,Stage and show technology: PC- and EtherCAT-based control technology – the universal platform for all systems,link,http://www.beckhoff.com/english.asp?press%2Fpr0512.htm,2012-02-24 11:43:02,1,0,0
beckhoff,119761528047992_365156526841823,,Embedded-PCs as basis for innovative building automation,link,http://www.pc-control.net/pdf/042011/pcc_0411_widex_e.pdf,2012-02-22 11:49:05,3,0,0
beckhoff,119761528047992_364450283579114,,Modular Embedded PCs of the second generation,link,http://www.pc-control.net/pdf/042011/pcc_0411_cover_e.pdf,2012-02-21 12:00:38,3,0,0
beckhoff,119761528047992_360906560600153,,PC-based Control for Photovoltaic Production,link,http://download.beckhoff.com/download/Document/catalog/Beckhoff_Photovoltaic_Production_2012.pdf,2012-02-16 13:34:17,2,0,0
beckhoff,119761528047992_359960604028082,,EtherCAT Terminals: new coupler series reduces costs and space requirements in the terminal box,link,http://www.beckhoff.com/english.asp?press%2Fpr2911.htm,2012-02-15 07:10:06,3,0,0
beckhoff,119761528047992_355551204469022,,EtherCAT-based power measurement terminal enables high-precision current control,link,http://www.pc-control.net/pdf/042011/pcc_0411_ietv_e.pdf,2012-02-09 08:28:34,1,0,0
beckhoff,119761528047992_369610073051717,The new generation of multi-touch Control Panel and Panel PCs offers maximum flexibility,Multi-touch Control Panel and Panel PCs from Beckhoff,video,http://www.youtube.com/watch?v=tIEBVdyhPsw,2012-02-08 09:06:10,14,1,3
beckhoff,119761528047992_103337129790005,CX9020 Embedded PC: Compact PC Control for a wider range of applications,CX9020 Embedded PC: Compact PC Control for a wider range of applications from Beckhoff,video,http://www.youtube.com/watch?v=Xf7DHxjtVAU,2012-02-03 13:22:36,4,1,0
beckhoff,119761528047992_351269198230556,,Beckhoff receives the Microsoft Embedded Partner Excellence Award 2011 in the category “Innovation”,link,http://www.beckhoff.com/english.asp?press%2Fnews0212.htm,2012-02-03 12:00:03,1,0,0
beckhoff,119761528047992_350485274975615,,"Tire Technology Expo 2012, Cologne/Germany: PC-based Control for the Tire and Rubber Industry",link,http://www.beckhoff.com/english.asp?beckhoff%2Ftire_tech.htm,2012-02-02 08:52:21,3,0,0
beckhoff,119761528047992_317088094993245,New CX2000 Embedded PC generation from Beckhoff,New CX2000 Embedded PC generation from Beckhoff,video,http://www.youtube.com/watch?v=IJzuIeXawXM,2012-02-02 07:44:41,3,0,2
beckhoff,119761528047992_162299980549775,New AM8000 servomotor generation from Beckhoff,New AM8000 servomotor generation from Beckhoff,video,http://www.youtube.com/watch?v=Jk9X6qlyBO8,2012-01-31 15:42:56,3,0,0
beckhoff,119761528047992_345415518815924,,World class concert acoustics with Beckhoff automation technology,link,http://www.pc-control.net/pdf/042011/pcc_0411_sibelius_e.pdf,2012-01-26 09:00:04,2,0,0
beckhoff,119761528047992_344154485608694,,Compact EtherCAT Bus Coupler,link,http://www.beckhoff.com/english.asp?bus_terminal%2Fbk1150.htm,2012-01-24 14:23:33,2,0,0
beckhoff,119761528047992_340503175973825,,Real-time Ethernet port multiplier,link,http://www.beckhoff.com/english.asp?pc_cards_switches%2Fcu2508.htm,2012-01-19 09:11:21,5,0,0
beckhoff,119761528047992_335843499773126,,Secure exchange of data between PROFIsafe and TwinSAFE networks,link,http://www.beckhoff.com/english.asp?ethercat%2Fel6930.htm,2012-01-12 09:34:07,0,0,0
beckhoff,119761528047992_334560369901439,,Interview on the release of TwinCAT 3,link,http://www.pc-control.net/pdf/042011/pcc_0411_interview_twincat3_e.pdf,2012-01-10 11:49:05,5,0,0
beckhoff,119761528047992_329781653712644,,Success for “Finn-Power” with PC-based NC controller from Beckhoff,link,http://www.pc-control.net/pdf/042011/pcc_0411_finn_power_e.pdf,2012-01-03 10:14:04,1,0,0
beckhoff,119761528047992_321379027886240,,The new AM8000 servomotor integrates the feedback system into one standard motor cable.,link,http://www.pc-control.net/pdf/042011/pcc_0411_am8000_e.pdf,2011-12-20 09:16:05,4,0,0
beckhoff,119761528047992_318398274850982,,Stiwa: EtherCAT Box modules form the basis for innovative assembly concept,link,http://www.pc-control.net/pdf/042011/pcc_0411_stiwa_e.pdf,2011-12-15 12:03:05,0,0,0
beckhoff,119761528047992_318398254850984,,High-end measurement: high-precision resistance measurement in a wide range,link,http://www.beckhoff.com/english.asp?ethercat%2Fel3692.htm,2011-12-15 12:03:03,0,0,0
beckhoff,119761528047992_338566499490335,Digital multimeter inside Bus Terminal I/O,EN | Digital multimeter inside Bus Terminal I/O,video,http://www.youtube.com/watch?v=RxZme6WO2-M,2011-12-15 08:41:09,7,0,2
beckhoff,119761528047992_312976035393206,,Planetary gear units for AM3100 Synchronous Servomotors,link,http://www.beckhoff.com/english.asp?drive_technology%2Fag2250.htm%3Fid=5569117337946,2011-12-07 13:30:18,1,0,0
beckhoff,119761528047992_309064182451058,,A plea for more production efficiency,link,http://www.pc-control.net/pdf/042011/pcc_0411_interview_e.pdf,2011-12-01 17:03:05,1,0,0
beckhoff,119761528047992_122818714496563,Beckhoff Trade Show TV | Day 3 at SPS/IPC/DRIVES 2011,EN | Beckhoff Trade Show TV | Day 3 at SPS/IPC/DRIVES 2011,video,http://www.youtube.com/watch?v=u06v87UK-1g,2011-11-25 17:47:12,5,0,0
beckhoff,119761528047992_236246976442473,"Beckhoff Trade Show TV | Day 2 at SPS/IPC/DRIVES 2011 
http://youtu.be/89eYf0ck57Q",EN | Beckhoff Trade Show TV | Day 2 at the SPS/IPC/DRIVES 2011,video,http://www.youtube.com/watch?v=89eYf0ck57Q,2011-11-24 19:56:30,3,0,0
beckhoff,119761528047992_128591767251360,"Beckhoff Trade Show TV | Day 1 at SPS/IPC/DRIVES 2011 
http://youtu.be/m7gYdr33Usw",EN | Beckhoff Trade Show TV | Day 1 at SPS/IPC/DRIVES 2011,video,http://www.youtube.com/watch?v=m7gYdr33Usw,2011-11-24 09:07:11,5,0,1
beckhoff,119761528047992_303465516344258,,PC-Control 04'11 is online,link,http://www.pc-control.net/english/042011/home.htm,2011-11-21 16:52:32,2,0,0
beckhoff,119761528047992_303465519677591,,First Beckhoff Automation UpDate in Turkey met with great interest,link,http://www.beckhoff.com/english.asp?press%2Fnews2211.htm,2011-11-21 16:52:32,2,0,0
beckhoff,119761528047992_299353516755458,,SPS/IPC/DRIVES 2011: AM8000 servomotors reduce material and commissioning costs,link,http://www.beckhoff.com/english.asp?beckhoff%2Fsps.htm,2011-11-14 11:31:03,4,0,0
beckhoff,119761528047992_297707316920078,,SPS/IPC/DRIVES 2011: multi-core express on a DIN rail,link,http://www.beckhoff.com/english.asp?beckhoff%2Fsps.htm,2011-11-11 10:53:05,5,0,0
beckhoff,119761528047992_296078717082938,,New Automation Technology at SPS/IPC/DRIVES 2011 from 22 – 24 November 2011 in Nuremberg/Germany,link,http://www.beckhoff.com/english.asp?beckhoff%2Fsps.htm,2011-11-08 10:44:21,3,0,0
beckhoff,119761528047992_293896577301152,,Swiss precision meets Beckhoff automation technology,link,http://www.pc-control.net/pdf/042011/pcc_0411_monnier_zahner_e.pdf,2011-11-03 16:53:35,1,0,0
beckhoff,119761528047992_293358804021596,,Sales offensive in Sweden: new branch offices opened in Stockholm and Gothenburg,link,http://www.beckhoff.com/english.asp?press%2Fnews2111.htm,2011-11-02 13:50:33,0,0,0
beckhoff,119761528047992_290675354289941,,Connectivity: from sensors to the IT cloud,link,http://www.pc-control.net/pdf/special_25_years_pcc/pcc_special_0811_connectivity_e.pdf,2011-10-27 14:36:04,2,0,0
beckhoff,119761528047992_290222384335238,,Scientific Automation: High measurement accuracy over a large frequency range,link,http://www.beckhoff.de/english/press/pr2311.htm,2011-10-26 15:41:05,2,0,0
beckhoff,119761528047992_287282697962540,,EtherCAT Terminal enables integration of Condition Monitoring functions,link,http://www.beckhoff.com/english.asp?ethercat%2Fel3632.htm,2011-10-20 12:58:04,0,0,0
beckhoff,119761528047992_284025898288220,,Scientific Automation integrates high-tech special functions into automation,link,http://www.pc-control.net/pdf/special_25_years_pcc/pcc_special_0811_interview_scientific_automation_e.pdf,2011-10-13 15:39:18,3,0,0
beckhoff,119761528047992_283446888346121,,Beckhoff Automation UpDate India,link,http://www.beckhoff.com/english.asp?press%2Fnews2011.htm,2011-10-12 11:28:34,0,0,0
beckhoff,119761528047992_292484720768361,Beckhoff Bus Terminals: The modular fieldbus system for automation,EN | Beckhoff Bus Terminals: The modular fieldbus system,video,http://www.youtube.com/watch?v=VbZ7DVLO5II,2011-09-20 15:09:53,3,0,2
beckhoff,119761528047992_251451474878996,,PCI Express cards: no limits for PROFIBUS process data,link,http://www.beckhoff.com/english/press/pr1811.htm,2011-08-08 15:13:47,1,0,0
